{
  "schemaVersion": "1.0.0",
  "generatedAtUtc": "2026-03-27T15:42:20Z",
  "component": {
    "id": "trade-feed",
    "kind": "service",
    "language": "JavaScript",
    "framework": "Node + Socket.IO",
    "buildTool": "npm",
    "sourcePath": "TraderSpec/codebase/generated-components/trade-feed-specfirst",
    "targetPath": "apps/trade-feed",
    "notes": "PubSub broker with publish/subscribe events."
  },
  "runtime": {
    "defaultPort": 18086,
    "dependsOn": [],
    "requiredEnv": ["TRADE_FEED_PORT","CORS_ALLOWED_ORIGINS"]
  },
  "contracts": {
    "primary": null
  },
  "traceability": {
    "requirements": ["SYS-FR-001","SYS-FR-004","SYS-NFR-004"],
    "stories": ["US-004","US-007"],
    "acceptanceCriteria": ["AC-001","AC-003"],
    "flows": ["F2","STARTUP"],
    "verificationRefs": ["TraderSpec/codebase/scripts/start-base-uncontainerized-hydrated.sh","TraderSpec/codebase/scripts/stop-base-uncontainerized-hydrated.sh","TraderSpec/codebase/scripts/test-trade-feed-overlay.sh"]
  },
  "constraints": {
    "preIngressCorsRequired": false
  }
}
