{
  "schemaVersion": "1.0.0",
  "generatedAtUtc": "2026-03-27T14:34:46Z",
  "component": {
    "id": "trade-service",
    "kind": "service",
    "language": "Java",
    "framework": "Spring Boot",
    "buildTool": "Gradle",
    "sourcePath": "TraderSpec/codebase/generated-components/trade-service-specfirst",
    "targetPath": "apps/trade-service",
    "notes": "Validates account+ticker and publishes new trade orders to /trades."
  },
  "runtime": {
    "defaultPort": 18092,
    "dependsOn": ["account-service","reference-data","people-service","trade-feed","trade-processor"],
    "requiredEnv": ["TRADING_SERVICE_PORT","ACCOUNT_SERVICE_URL","ACCOUNT_SERVICE_HOST","REFERENCE_DATA_SERVICE_URL","REFERENCE_DATA_HOST","PEOPLE_SERVICE_URL","PEOPLE_SERVICE_HOST","TRADE_FEED_ADDRESS","TRADE_FEED_HOST","CORS_ALLOWED_ORIGINS"]
  },
  "contracts": {
    "primary": "TraderSpec/speckit/contracts/trade-service/openapi.yaml"
  },
  "traceability": {
    "requirements": ["SYS-FR-001","SYS-FR-006","SYS-FR-010","SYS-FR-011","SYS-NFR-007"],
    "stories": ["US-003","US-007","US-008","US-009"],
    "acceptanceCriteria": ["AC-001","AC-004","AC-009"],
    "flows": ["F3","STARTUP"],
    "verificationRefs": ["TraderSpec/codebase/scripts/start-base-uncontainerized-hydrated.sh","TraderSpec/codebase/scripts/status-base-uncontainerized-hydrated.sh","TraderSpec/codebase/scripts/test-trade-service-overlay.sh","TraderSpec/pipeline/validate-regeneration-readiness.sh"]
  },
  "constraints": {
    "preIngressCorsRequired": false
  }
}
