{
  "schemaVersion": "1.0.0",
  "generatedAtUtc": "2026-03-27T15:42:20Z",
  "component": {
    "id": "web-front-end-angular",
    "kind": "ui",
    "language": "TypeScript",
    "framework": "Angular",
    "buildTool": "npm",
    "sourcePath": "TraderSpec/codebase/generated-components/web-front-end-angular-specfirst",
    "targetPath": "apps/web-front-end/angular",
    "notes": "Primary UI for account/trade workflows with FINOS TraderX branding assets."
  },
  "runtime": {
    "defaultPort": 18093,
    "dependsOn": ["account-service","trade-service","position-service","reference-data","people-service","trade-feed","trade-processor"],
    "requiredEnv": ["WEB_SERVICE_PORT"]
  },
  "contracts": {
    "primary": null
  },
  "traceability": {
    "requirements": ["SYS-FR-001","SYS-NFR-003","SYS-NFR-006"],
    "stories": ["US-001","US-007"],
    "acceptanceCriteria": ["AC-001","AC-009"],
    "flows": ["F2","STARTUP"],
    "verificationRefs": ["TraderSpec/codebase/scripts/start-base-uncontainerized-hydrated.sh","TraderSpec/codebase/scripts/test-web-angular-overlay.sh"]
  },
  "constraints": {
    "preIngressCorsRequired": false
  }
}
