{
  "schemaVersion": "1.0.0",
  "generatedAtUtc": "2026-03-27T14:34:45Z",
  "component": {
    "id": "people-service",
    "kind": "service",
    "language": "C#",
    "framework": "ASP.NET Core",
    "buildTool": "dotnet",
    "sourcePath": "TraderSpec/codebase/generated-components/people-service-specfirst",
    "targetPath": "apps/people-service",
    "notes": "Directory lookups and person validation."
  },
  "runtime": {
    "defaultPort": 18089,
    "dependsOn": [],
    "requiredEnv": ["PEOPLE_SERVICE_PORT","CORS_ALLOWED_ORIGINS"]
  },
  "contracts": {
    "primary": "TraderSpec/speckit/contracts/people-service/openapi.yaml"
  },
  "traceability": {
    "requirements": ["SYS-FR-001","SYS-FR-009","SYS-FR-011","SYS-NFR-001"],
    "stories": ["US-001","US-006","US-007","US-008"],
    "acceptanceCriteria": ["AC-001","AC-007","AC-008","AC-009"],
    "flows": ["F1","F6","STARTUP"],
    "verificationRefs": ["TraderSpec/codebase/scripts/start-base-uncontainerized-hydrated.sh","TraderSpec/codebase/scripts/test-people-service-overlay.sh"]
  },
  "constraints": {
    "preIngressCorsRequired": true
  }
}
