{
  "schemaVersion": "1.0.0",
  "generatedAtUtc": "2026-03-27T17:39:38+03:00",
  "component": {
    "id": "position-service",
    "kind": "service",
    "language": "Java",
    "framework": "Spring Boot",
    "buildTool": "Gradle",
    "sourcePath": "TraderSpec/codebase/generated-components/position-service-specfirst",
    "targetPath": "apps/position-service",
    "notes": "Trades/positions read model APIs."
  },
  "runtime": {
    "defaultPort": 18090,
    "dependsOn": ["database"],
    "requiredEnv": ["POSITION_SERVICE_PORT","DATABASE_TCP_HOST","DATABASE_TCP_PORT","DATABASE_NAME","DATABASE_DBUSER","DATABASE_DBPASS","CORS_ALLOWED_ORIGINS"]
  },
  "contracts": {
    "primary": "TraderSpec/speckit/contracts/position-service/openapi.yaml"
  },
  "traceability": {
    "requirements": ["SYS-FR-001","SYS-FR-003","SYS-FR-011"],
    "stories": ["US-002","US-007","US-008"],
    "acceptanceCriteria": ["AC-001","AC-003","AC-009"],
    "flows": ["F2","STARTUP"],
    "verificationRefs": ["TraderSpec/codebase/scripts/start-base-uncontainerized-hydrated.sh","TraderSpec/codebase/scripts/test-position-service-overlay.sh"]
  },
  "constraints": {
    "preIngressCorsRequired": false
  }
}
