{
  "schemaVersion": "1.0.0",
  "generatedAtUtc": "2026-03-27T14:34:45Z",
  "component": {
    "id": "account-service",
    "kind": "service",
    "language": "Java",
    "framework": "Spring Boot",
    "buildTool": "Gradle",
    "sourcePath": "TraderSpec/codebase/generated-components/account-service-specfirst",
    "targetPath": "apps/account-service",
    "notes": "Accounts and account-user mappings."
  },
  "runtime": {
    "defaultPort": 18088,
    "dependsOn": ["database","people-service"],
    "requiredEnv": ["ACCOUNT_SERVICE_PORT","DATABASE_TCP_HOST","PEOPLE_SERVICE_HOST","PEOPLE_SERVICE_URL","CORS_ALLOWED_ORIGINS"]
  },
  "contracts": {
    "primary": "TraderSpec/speckit/contracts/account-service/openapi.yaml"
  },
  "traceability": {
    "requirements": ["SYS-FR-001","SYS-FR-002","SYS-FR-006","SYS-FR-008","SYS-FR-009","SYS-FR-011","SYS-NFR-001","SYS-NFR-005"],
    "stories": ["US-001","US-003","US-005","US-006","US-007","US-008","US-009"],
    "acceptanceCriteria": ["AC-001","AC-002","AC-004","AC-006","AC-007","AC-008","AC-009"],
    "flows": ["F1","F3","F5","F6","STARTUP"],
    "verificationRefs": ["TraderSpec/codebase/scripts/start-base-uncontainerized-hydrated.sh","TraderSpec/codebase/scripts/test-account-service-overlay.sh","TraderSpec/codebase/scripts/test-people-service-overlay.sh","TraderSpec/codebase/scripts/test-trade-service-overlay.sh","TraderSpec/pipeline/speckit/validate-speckit-readiness.sh"]
  },
  "constraints": {
    "preIngressCorsRequired": true
  }
}
